Accession	Length	E-value	Definition	Organism	Taxonomy	Release Year	query_start	query_end	subject_start	subject_end	Align_Length	Query_Length	Identity(%)	Coverage(%)	Pass_Filter
PP906247	654	0.024		Hormonema sp.	Eukaryota; Fungi; Dikarya; Ascomycota; Pezizomycotina; Dothideomycetes; Dothideomycetidae; Dothideales; Dothioraceae; Hormonema	2025	1	24	614	637	24	24	100.00	100.00	YES
PP841139	41168	0.024		Acinetobacter phage vB_Ab_164_KEN_03	Viruses	2024	1	24	41138	41161	24	24	100.00	100.00	YES
PP841139	41168	0.024		Acinetobacter phage vB_Ab_164_KEN_03	Viruses	2024	1	24	42	19	24	24	100.00	100.00	YES
PQ672687	1086	0.024		Chaenocephalus aceratus	Eukaryota; Metazoa; Chordata; Craniata; Vertebrata; Euteleostomi; Actinopterygii; Neopterygii; Teleostei; Neoteleostei; Acanthomorphata; Eupercaria; Perciformes; Notothenioidei; Channichthyidae; Chaenocephalus	2025	1	24	43	20	24	24	100.00	100.00	YES
CP184727	16439	0.024		Klebsiella pneumoniae	Bacteria; Pseudomonadati; Pseudomonadota; Gammaproteobacteria; Enterobacterales; Enterobacteriaceae; Klebsiella; Klebsiella pneumoniae complex	2025	1	24	65	42	24	24	100.00	100.00	YES
CP185170	29318	0.024		Klebsiella pneumoniae	Bacteria; Pseudomonadati; Pseudomonadota; Gammaproteobacteria; Enterobacterales; Enterobacteriaceae; Klebsiella; Klebsiella pneumoniae complex	2025	1	24	45	22	24	24	100.00	100.00	YES
PP593777	1495	0.024		Chryseobacterium sp.	Bacteria; Pseudomonadati; Bacteroidota; Flavobacteriia; Flavobacteriales; Weeksellaceae; Chryseobacterium group; Chryseobacterium	2024	1	24	24	1	24	24	100.00	100.00	YES
XM_028290633	5656	1.5		Diabrotica virgifera virgifera	Eukaryota; Metazoa; Ecdysozoa; Arthropoda; Hexapoda; Insecta; Pterygota; Neoptera; Endopterygota; Coleoptera; Polyphaga; Cucujiformia; Chrysomeloidea; Chrysomelidae; Galerucinae; Diabroticina; Diabroticites; Diabrotica	2022	4	24	892	912	21	24	100.00	88.00	YES
XM_022206751	3658	5.9		Acanthochromis polyacanthus	Eukaryota; Metazoa; Chordata; Craniata; Vertebrata; Euteleostomi; Actinopterygii; Neopterygii; Teleostei; Neoteleostei; Acanthomorphata; Ovalentaria; Pomacentridae; Acanthochromis	2023	4	23	20	39	20	24	100.00	83.00	YES
OZ349218	17603202	5.9		Elachista serricornis	Eukaryota; Metazoa; Ecdysozoa; Arthropoda; Hexapoda; Insecta; Pterygota; Neoptera; Endopterygota; Lepidoptera; Glossata; Ditrysia; Gelechioidea; Elachistidae; Elachistinae; Elachista	2025	2	21	10529836	10529817	20	24	100.00	83.00	YES
