Accession	Length	E-value	Definition	Organism	Taxonomy	Release Year	query_start	query_end	subject_start	subject_end	Align_Length	Query_Length	Identity(%)	Coverage(%)	Pass_Filter
OZ349876	85671283	0.38		Endomychus armeniacus	Eukaryota; Metazoa; Ecdysozoa; Arthropoda; Hexapoda; Insecta; Pterygota; Neoptera; Endopterygota; Coleoptera; Polyphaga; Cucujiformia; Coccinelloidea; Endomychidae; Endomychus	2025	2	23	85246755	85246734	22	24	100.00	92.00	YES
OZ318077	98745240	5.9		Gastrolepidia clavigera	Eukaryota; Metazoa; Spiralia; Lophotrochozoa; Annelida; Polychaeta; Errantia; Phyllodocida; Polynoidae; Gastrolepidia	2025	2	21	61103780	61103761	20	24	100.00	83.00	YES
OZ243840	63198867	5.9		Teucrium scorodonia	Eukaryota; Viridiplantae; Streptophyta; Embryophyta; Tracheophyta; Spermatophyta; Magnoliopsida; eudicotyledons; Gunneridae; Pentapetalae; asterids; lamiids; Lamiales; Lamiaceae; Ajugoideae; Teucrieae; Teucrium	2025	3	22	38979955	38979974	20	24	100.00	83.00	YES
OZ026625	96355236	5.9		Hermodice carunculata	Eukaryota; Metazoa; Spiralia; Lophotrochozoa; Annelida; Polychaeta; Errantia; Eunicida; Amphinomidae; Hermodice	2024	1	20	3212571	3212590	20	24	100.00	83.00	YES
OY987235	20484918	5.9		Odiellus spinosus	Eukaryota; Metazoa; Ecdysozoa; Arthropoda; Chelicerata; Arachnida; Opiliones; Palpatores; Phalangioidea; Phalangiidae; Odiellus	2023	2	21	7351709	7351728	20	24	100.00	83.00	YES
