Accession	Length	E-value	Definition	Organism	Taxonomy_x	Release Year_x	query_start	query_end	subject_start	subject_end	Align_Length	Query_Length	Identity(%)	Coverage(%)	Pass_Filter	Source_File	Accession_clean	Description	Taxonomy_y	Accession Length	Sequencing Technology	Molecule Type	Topology	Assembly	Release Year_y
OP583592	45223	0.024		Xanthomonas phage GF2	Viruses; Duplodnaviria; Heunggongvirae; Uroviricota; Caudoviricetes; Autographivirales; Autonotataviridae; Gujervirinae; Pradovirus	2022	1	24	45163	45186	24	24	100.00	100.00	YES	Barcode_72_forward_end_BC72_rev_From_Porechop__GTCGGTATGGAAGACAGTCAGCTA_description_table	OP583592	Xanthomonas phage GF2, complete genome	Viruses; Duplodnaviria; Heunggongvirae; Uroviricota; Caudoviricetes; Autographivirales; Autonotataviridae; Gujervirinae; Pradovirus	45223	Oxford Nanopore	DNA	linear	##Assembly-Data-START## ; Assembly Method :: Canu v. 2.2 ; Coverage :: 100x ; Sequencing Technology :: Oxford Nanopore ; ##Assembly-Data-END##	2022
OP583592	45223	0.024		Xanthomonas phage GF2	Viruses; Duplodnaviria; Heunggongvirae; Uroviricota; Caudoviricetes; Autographivirales; Autonotataviridae; Gujervirinae; Pradovirus	2022	1	24	57	34	24	24	100.00	100.00	YES	Barcode_72_forward_end_BC72_rev_From_Porechop__GTCGGTATGGAAGACAGTCAGCTA_description_table	OP583592	Xanthomonas phage GF2, complete genome	Viruses; Duplodnaviria; Heunggongvirae; Uroviricota; Caudoviricetes; Autographivirales; Autonotataviridae; Gujervirinae; Pradovirus	45223	Oxford Nanopore	DNA	linear	##Assembly-Data-START## ; Assembly Method :: Canu v. 2.2 ; Coverage :: 100x ; Sequencing Technology :: Oxford Nanopore ; ##Assembly-Data-END##	2022
CP120995	4576	0.024		Streptomyces laculatispora	Bacteria; Bacillati; Actinomycetota; Actinomycetes; Kitasatosporales; Streptomycetaceae; Streptomyces	2023	1	24	709	686	24	24	100.00	100.00	YES	Barcode_72_forward_end_BC72_rev_From_Porechop__GTCGGTATGGAAGACAGTCAGCTA_description_table	CP120995	Streptomyces laculatispora strain Mut2 plasmid unnamed3	Bacteria; Bacillati; Actinomycetota; Actinomycetes; Kitasatosporales; Streptomycetaceae; Streptomyces	4576	Oxford Nanopore	DNA	linear	The annotation was added by the NCBI Prokaryotic Genome Annotation Pipeline (PGAP). Information about PGAP can be found here: https://www.ncbi.nlm.nih.gov/genome/annotation_prok/; ##Genome-Assembly-Data-START## ; Assembly Method :: Flye v. 2.9.1-b1780 ; Genome Representation :: Full ; Expected Final Version :: Yes ; Genome Coverage :: 459x ; Sequencing Technology :: Oxford Nanopore PromethION ; ##Genome-Assembly-Data-END##; ##Genome-Annotation-Data-START## ; Annotation Provider :: NCBI ; Annotation Date :: 03/30/2023 14:13:23 ; Annotation Pipeline :: NCBI Prokaryotic Genome Annotation Pipeline (PGAP) ; Annotation Method :: Best-placed reference protein set; GeneMarkS-2+ ; Annotation Software revision :: 6.5 ; Features Annotated :: Gene; CDS; rRNA; tRNA; ncRNA ; Genes (total) :: 7,665 ; CDSs (total) :: 7,574 ; Genes (coding) :: 7,091 ; CDSs (with protein) :: 7,091 ; Genes (RNA) :: 91 ; rRNAs :: 6, 6, 6 (5S, 16S, 23S) ; complete rRNAs :: 6, 6, 6 (5S, 16S, 23S) ; tRNAs :: 70 ; ncRNAs :: 3 ; Pseudo Genes (total) :: 483 ; CDSs (without protein) :: 483 ; Pseudo Genes (ambiguous residues) :: 0 of 483 ; Pseudo Genes (frameshifted) :: 257 of 483 ; Pseudo Genes (incomplete) :: 310 of 483 ; Pseudo Genes (internal stop) :: 28 of 483 ; Pseudo Genes (multiple problems) :: 102 of 483 ; CRISPR Arrays :: 1 ; ##Genome-Annotation-Data-END##	2023
OZ414244	20308588	1.5		Scythropia crataegella	Eukaryota; Metazoa; Ecdysozoa; Arthropoda; Hexapoda; Insecta; Pterygota; Neoptera; Endopterygota; Lepidoptera; Glossata; Ditrysia; Yponomeutoidea; Scythropiidae; Scythropia	2026	4	24	937869	937849	21	24	100.00	88.00	YES	Barcode_72_forward_end_BC72_rev_From_Porechop__GTCGGTATGGAAGACAGTCAGCTA_description_table	OZ414244	Scythropia crataegella genome assembly, chromosome: 12	Eukaryota; Metazoa; Ecdysozoa; Arthropoda; Hexapoda; Insecta; Pterygota; Neoptera; Endopterygota; Lepidoptera; Glossata; Ditrysia; Yponomeutoidea; Scythropiidae; Scythropia	20308588	Oxford Nanopore	DNA	linear	The assembly ilScyCrat1.1 is based on 41x PacBio data and Arima2 Hi-C data generated by the Darwin Tree of Life Project~(https://www.darwintreeoflife.org/). The assembly process included the following sequence of steps: initial PacBio assembly generation with Hifiasm, and Hi-C based scaffolding with YaHS. The mitochondrial genome was assembled using MitoHiFi. A manually phased assembly (based on HiC signal) was generated from a jointly curated primary and alt assembly. Finally, the primary assembly was analysed and manually improved using TreeVal. Chromosome-scale scaffolds confirmed by the Hi-C data have been named in order of size. The Z sex chromosome has been identified by copy number and read coverage in the haploid assembly. No W chromosome was found. The exact order and orientation of the contigs on chromosome 19 (11.3 Mbp - end) is unknown.	2026
OX359201	6903244	5.9		Chondrosia reniformis	Eukaryota; Metazoa; Porifera; Demospongiae; Verongimorpha; Chondrillida; Chondrillidae; Chondrosia	2022	2	21	1053899	1053918	20	24	100.00	83.00	YES	Barcode_72_forward_end_BC72_rev_From_Porechop__GTCGGTATGGAAGACAGTCAGCTA_description_table	OX359201	Chondrosia reniformis genome assembly, chromosome: 13	Eukaryota; Metazoa; Porifera; Demospongiae; Verongimorpha; Chondrillida; Chondrillidae; Chondrosia	6903244		DNA	linear	The assembly odChoReni1.1 is based on 70x PacBio data and Arima2 Hi-C data generated by the Aquatic Symbiosis Genomics Project (https://www.aquaticsymbiosisgenomics.org/). The assembly process included the following sequence of steps: initial PacBio assembly generation with Hifiasm, retained haplotig separation with purge_dups, and Hi-C based scaffolding with YaHS. The mitochondrial genome was assembled using MitoHiFi. Finally, the primary assembly was analysed and manually improved using gEVAL. Chromosome-scale scaffolds confirmed by the Hi-C data have been named in order of size.	2022
OZ316995	94363174	5.9		Arianta arbustorum	Eukaryota; Metazoa; Spiralia; Lophotrochozoa; Mollusca; Gastropoda; Heterobranchia; Euthyneura; Panpulmonata; Eupulmonata; Stylommatophora; Helicina; Helicoidea; Helicidae; Arianta	2025	4	23	81993732	81993713	20	24	100.00	83.00	YES	Barcode_72_forward_end_BC72_rev_From_Porechop__GTCGGTATGGAAGACAGTCAGCTA_description_table	OZ316995	Arianta arbustorum genome assembly, chromosome: 6	Eukaryota; Metazoa; Spiralia; Lophotrochozoa; Mollusca; Gastropoda; Heterobranchia; Euthyneura; Panpulmonata; Eupulmonata; Stylommatophora; Helicina; Helicoidea; Helicidae; Arianta	94363174		DNA	linear	The assembly xgAriArbu4.1 is based on 40x PacBio data and Arima2 Hi-C data generated by the Darwin Tree of Life Project~(https://www.darwintreeoflife.org/). The assembly process included the following sequence of steps: initial PacBio assembly generation with Hifiasm, and Hi-C based scaffolding with YaHS. The mitochondrial genome was assembled using MitoHiFi. Finally, the primary assembly was analysed and manually improved using TreeVal. Chromosome-scale scaffolds confirmed by the Hi-C data have been named in order of size.	2025
