Accession	Length	E-value	Definition	Organism	Taxonomy_x	Release Year_x	query_start	query_end	subject_start	subject_end	Align_Length	Query_Length	Identity(%)	Coverage(%)	Pass_Filter	Source_File	Accession_clean	Description	Taxonomy_y	Accession Length	Sequencing Technology	Molecule Type	Topology	Assembly	Release Year_y
OZ247521	82122220	1.5		Bradysia coprophila	Eukaryota; Metazoa; Ecdysozoa; Arthropoda; Hexapoda; Insecta; Pterygota; Neoptera; Endopterygota; Diptera; Nematocera; Sciaroidea; Sciaridae; Bradysia	2025	1	21	2684769	2684789	21	24	100.00	88.00	YES	RLB12__GTTGAGTTACAAAGCACCGATCAG_description_table	OZ247521	Bradysia coprophila genome assembly, chromosome: GRC1	Eukaryota; Metazoa; Ecdysozoa; Arthropoda; Hexapoda; Insecta; Pterygota; Neoptera; Endopterygota; Diptera; Nematocera; Sciaroidea; Sciaridae; Bradysia	82122220		DNA	linear	The assembly idBraCopr2.1 is based on 59x PacBio data and Arima2 Hi-C data generated by the Wellcome Sanger Institute Tree of Life Programme (https://www.sanger.ac.uk/programme/tree-of-life/). The assembly process included the following sequence of steps: initial PacBio assembly generation with Hifiasm, and Hi-C based scaffolding with YaHS. The mitochondrial genome was assembled using MitoHiFi. A manually phased assembly (based on HiC signal) was generated from a jointly curated primary and alt assembly. Finally, the primary assembly was analysed and manually improved using TreeVal. Chromosome-scale scaffolds confirmed by the Hi-C data have been named in order of size. GRC1 and GRC2 are germline restricted chromosomes. GRC naming is based on coverage patterns identified in https://doi.org/10.1371/journal.pbio.3001559.	2025
CP141343	66382070	5.9		Macaca fascicularis	Eukaryota; Metazoa; Chordata; Craniata; Vertebrata; Euteleostomi; Mammalia; Eutheria; Euarchontoglires; Primates; Haplorrhini; Catarrhini; Cercopithecidae; Cercopithecinae; Macaca	2025	5	24	10614481	10614500	20	24	100.00	83.00	YES	RLB12__GTTGAGTTACAAAGCACCGATCAG_description_table	CP141343	Macaca fascicularis isolate 582-1 chromosome 19	Eukaryota; Metazoa; Chordata; Craniata; Vertebrata; Euteleostomi; Mammalia; Eutheria; Euarchontoglires; Primates; Haplorrhini; Catarrhini; Cercopithecidae; Cercopithecinae; Macaca	66382070	Oxford Nanopore	DNA	linear	##Genome-Assembly-Data-START## ; Assembly Method :: Verkko v. 1.2 ; Assembly Name :: T2T-MFA8v1.0 ; Genome Representation :: Full ; Expected Final Version :: Yes ; Genome Coverage :: 76.0x ; Sequencing Technology :: PacBio Sequel; Oxford Nanopore PromethION; Illumina NovaSeq ; ##Genome-Assembly-Data-END##	2025
CP018162	32465040	5.9		Oryza sativa Indica Group	Eukaryota; Viridiplantae; Streptophyta; Embryophyta; Tracheophyta; Spermatophyta; Magnoliopsida; Liliopsida; Poales; Poaceae; BOP clade; Oryzoideae; Oryzeae; Oryzinae; Oryza; Oryza sativa	2017	2	21	23977097	23977078	20	24	100.00	83.00	YES	RLB12__GTTGAGTTACAAAGCACCGATCAG_description_table	CP018162	Oryza sativa Indica Group cultivar Shuhui498 chromosome 6, partial sequence	Eukaryota; Viridiplantae; Streptophyta; Embryophyta; Tracheophyta; Spermatophyta; Magnoliopsida; Liliopsida; Poales; Poaceae; BOP clade; Oryzoideae; Oryzeae; Oryzinae; Oryza; Oryza sativa	32465040		DNA	linear	##Genome-Assembly-Data-START## ; Assembly Date :: 22-NOV-2016 ; Assembly Method :: Celera Assembler v. wgs-8.3rc2; Falcon v. 2016-5-12; Celera Assembler v. CANU:2016-5-21 ; Assembly Name :: R498.Genome.version1 ; Genome Representation :: Full ; Expected Final Version :: No ; Genome Coverage :: 120.0x ; Sequencing Technology :: PacBio ; ##Genome-Assembly-Data-END##	2017
AP027390	31153026	5.9		Oryza sativa indica subgroup	Eukaryota; Viridiplantae; Streptophyta; Embryophyta; Tracheophyta; Spermatophyta; Magnoliopsida; Liliopsida; Poales; Poaceae; BOP clade; Oryzoideae; Oryzeae; Oryzinae; Oryza; Oryza sativa	2024	2	21	22369815	22369796	20	24	100.00	83.00	YES	RLB12__GTTGAGTTACAAAGCACCGATCAG_description_table	AP027390	Oryza sativa indica subgroup Inn Ma Yebaw DNA, chromosome: 6	Eukaryota; Viridiplantae; Streptophyta; Embryophyta; Tracheophyta; Spermatophyta; Magnoliopsida; Liliopsida; Poales; Poaceae; BOP clade; Oryzoideae; Oryzeae; Oryzinae; Oryza; Oryza sativa	31153026		DNA	linear	##Genome-Assembly-Data-START## ; Assembly Method :: FALCON v. 0.5 ; Assembly Name :: OsIYB_1.0 ; Genome Coverage :: 30x ; Sequencing Technology :: PacBio Sequel; MGI DNBSEQ ; ##Genome-Assembly-Data-END##	2024
CP141113	32816747	5.9		Oryza sativa indica subgroup	Eukaryota; Viridiplantae; Streptophyta; Embryophyta; Tracheophyta; Spermatophyta; Magnoliopsida; Liliopsida; Poales; Poaceae; BOP clade; Oryzoideae; Oryzeae; Oryzinae; Oryza; Oryza sativa	2023	2	21	24367859	24367840	20	24	100.00	83.00	YES	RLB12__GTTGAGTTACAAAGCACCGATCAG_description_table	CP141113	Oryza sativa indica subgroup cultivar ZH8015 chromosome 06	Eukaryota; Viridiplantae; Streptophyta; Embryophyta; Tracheophyta; Spermatophyta; Magnoliopsida; Liliopsida; Poales; Poaceae; BOP clade; Oryzoideae; Oryzeae; Oryzinae; Oryza; Oryza sativa	32816747	Oxford Nanopore	DNA	linear	##Genome-Assembly-Data-START## ; Assembly Method :: Hifiasm v. 0.16.1 ; Genome Representation :: Full ; Expected Final Version :: Yes ; Genome Coverage :: 90.0x ; Sequencing Technology :: PacBio; Illumina; Oxford Nanopore ; ##Genome-Assembly-Data-END##	2023
CP056057	32119910	5.9		Oryza sativa Indica Group	Eukaryota; Viridiplantae; Streptophyta; Embryophyta; Tracheophyta; Spermatophyta; Magnoliopsida; Liliopsida; Poales; Poaceae; BOP clade; Oryzoideae; Oryzeae; Oryzinae; Oryza; Oryza sativa	2021	2	21	23612773	23612754	20	24	100.00	83.00	YES	RLB12__GTTGAGTTACAAAGCACCGATCAG_description_table	CP056057	Oryza sativa Indica Group cultivar Zhenshan 97 chromosome 6	Eukaryota; Viridiplantae; Streptophyta; Embryophyta; Tracheophyta; Spermatophyta; Magnoliopsida; Liliopsida; Poales; Poaceae; BOP clade; Oryzoideae; Oryzeae; Oryzinae; Oryza; Oryza sativa	32119910		DNA	linear	On Apr 2, 2021 this sequence version replaced CM003915.2.; ##Genome-Assembly-Data-START## ; Assembly Date :: 01-NOV-2019 ; Assembly Method :: FALCON v. falcon-kit 1.5.2; CANU v. 1.8; MECAT2 v. 20190314; Flye v. 2.6; Wtdbg2 v. 2.5; NextDenovo v. v2.1-beta.0 ; Assembly Name :: ZS97RS3 ; Genome Representation :: Full ; Expected Final Version :: No ; Genome Coverage :: 100.0x ; Sequencing Technology :: PacBio ; ##Genome-Assembly-Data-END##	2021
