Accession	Length	E-value	Definition	Organism	Taxonomy_x	Release Year_x	query_start	query_end	subject_start	subject_end	Align_Length	Query_Length	Identity(%)	Coverage(%)	Pass_Filter	Source_File	Accession_clean	Description	Taxonomy_y	Accession Length	Sequencing Technology	Molecule Type	Topology	Assembly	Release Year_y
PQ672720	458	0.31		Notothenia rossii	Eukaryota; Metazoa; Chordata; Craniata; Vertebrata; Euteleostomi; Actinopterygii; Neopterygii; Teleostei; Neoteleostei; Acanthomorphata; Eupercaria; Perciformes; Notothenioidei; Nototheniidae; Notothenia	2025	1	22	296	317	22	24	100.00	92.00	YES	Barcode_52_forward_end_BC52_rev_From_Porechop__GTCCACGAACAATCTTGTCTCTCA_description_table	PQ672720	Notothenia rossii clone NOR_262 D-loop, partial sequence; mitochondrial	Eukaryota; Metazoa; Chordata; Craniata; Vertebrata; Euteleostomi; Actinopterygii; Neopterygii; Teleostei; Neoteleostei; Acanthomorphata; Eupercaria; Perciformes; Notothenioidei; Nototheniidae; Notothenia	458	Oxford Nanopore	DNA	linear	##Assembly-Data-START## ; Assembly Method :: Geneious v. 2025.0.2 ; Assembly Name :: Map to Reference ; Sequencing Technology :: Oxford Nanoport Technology, MinION Mk1B ; ##Assembly-Data-END##	2025
LR761650	17539550	1.2		Maniola hyperantus	Eukaryota; Metazoa; Ecdysozoa; Arthropoda; Hexapoda; Insecta; Pterygota; Neoptera; Endopterygota; Lepidoptera; Glossata; Ditrysia; Papilionoidea; Nymphalidae; Satyrinae; Satyrini; Maniolina; Maniola; Aphantopus	2021	4	24	4317885	4317865	21	24	100.00	88.00	YES	Barcode_52_forward_end_BC52_rev_From_Porechop__GTCCACGAACAATCTTGTCTCTCA_description_table	LR761650	Aphantopus hyperantus genome assembly, chromosome: Z	Eukaryota; Metazoa; Ecdysozoa; Arthropoda; Hexapoda; Insecta; Pterygota; Neoptera; Endopterygota; Lepidoptera; Glossata; Ditrysia; Papilionoidea; Nymphalidae; Satyrinae; Satyrini; Maniolina; Maniola; Aphantopus	17539550		DNA	linear	The assembly iAphHyp1.2 is based on 50x PacBio data, 61x 10X Genomics Chromium data, and 81x Arima Hi-C data from a separate individual iAphHyp4 generated at the Wellcome Sanger Institute. The assembly process included the following sequence of steps: initial PacBio assembly generation with Falcon-unzip, retained haplotig identification with purge_dups, 10X based scaffolding with scaff10x, Hi-C based scaffolding with SALSA2, Arrow polishing, and two rounds of FreeBayes polishing. Finally, the assembly was analysed and manually improved using gEVAL. Chromosome-scale scaffolds confirmed by the Hi-C data have been named in order of size.	2021
OY755099	17540200	1.2		Maniola hyperantus	Eukaryota; Metazoa; Ecdysozoa; Arthropoda; Hexapoda; Insecta; Pterygota; Neoptera; Endopterygota; Lepidoptera; Glossata; Ditrysia; Papilionoidea; Nymphalidae; Satyrinae; Satyrini; Maniolina; Maniola; Aphantopus	2023	4	24	13296778	13296798	21	24	100.00	88.00	YES	Barcode_52_forward_end_BC52_rev_From_Porechop__GTCCACGAACAATCTTGTCTCTCA_description_table	OY755099	Aphantopus hyperantus genome assembly, chromosome: Z	Eukaryota; Metazoa; Ecdysozoa; Arthropoda; Hexapoda; Insecta; Pterygota; Neoptera; Endopterygota; Lepidoptera; Glossata; Ditrysia; Papilionoidea; Nymphalidae; Satyrinae; Satyrini; Maniolina; Maniola; Aphantopus	17540200		DNA	linear	The assembly ilAphHype2.1 is based on 205x PacBio data and Arima Hi-C data generated by the Darwin Tree of Life Project~(https://www.darwintreeoflife.org/). The assembly process included the following sequence of steps: initial PacBio assembly generation with Hifiasm, retained haplotig separation with purge_dups, and Hi-C based scaffolding with YaHS. The mitochondrial genome was assembled using MitoHiFi. Finally, the primary assembly was analysed and manually improved using gEVAL. Chromosome-scale scaffolds confirmed by the Hi-C data have been named in order of size. Z chromosome identified based on synteny with Maniola hyperantus ( GCA_902806685.2).	2023
OY982928	15213276	4.8		Pyrrhia umbra	Eukaryota; Metazoa; Ecdysozoa; Arthropoda; Hexapoda; Insecta; Pterygota; Neoptera; Endopterygota; Lepidoptera; Glossata; Ditrysia; Noctuoidea; Noctuidae; Heliothinae; Pyrrhia	2023	5	24	11966830	11966811	20	24	100.00	83.00	YES	Barcode_52_forward_end_BC52_rev_From_Porechop__GTCCACGAACAATCTTGTCTCTCA_description_table	OY982928	Pyrrhia umbra genome assembly, chromosome: 11	Eukaryota; Metazoa; Ecdysozoa; Arthropoda; Hexapoda; Insecta; Pterygota; Neoptera; Endopterygota; Lepidoptera; Glossata; Ditrysia; Noctuoidea; Noctuidae; Heliothinae; Pyrrhia	15213276		DNA	linear	The assembly ilPyrUmbr1.1 is based on 47x PacBio data and Arima2 Hi-C data generated by the Darwin Tree of Life Project~(https://www.darwintreeoflife.org/). The assembly process included the following sequence of steps: initial PacBio assembly generation with Hifiasm, retained haplotig separation with purge_dups, and Hi-C based scaffolding with YaHS. The mitochondrial genome was assembled using MitoHiFi. Finally, the primary assembly was analysed and manually improved using rapid curation. Chromosome-scale scaffolds confirmed by the Hi-C data have been named in order of size. Z chromosome identified by synteny to Heliothis peltigera ( GCA_958496145.1).	2023
OZ076462	91502549	4.8		Cornu aspersum	Eukaryota; Metazoa; Spiralia; Lophotrochozoa; Mollusca; Gastropoda; Heterobranchia; Euthyneura; Panpulmonata; Eupulmonata; Stylommatophora; Helicina; Helicoidea; Helicidae; Cornu; Cornu	2024	1	24	54446215	54446238	24	24	95.83	100.00	YES	Barcode_52_forward_end_BC52_rev_From_Porechop__GTCCACGAACAATCTTGTCTCTCA_description_table	OZ076462	Cornu aspersum genome assembly, chromosome: 19	Eukaryota; Metazoa; Spiralia; Lophotrochozoa; Mollusca; Gastropoda; Heterobranchia; Euthyneura; Panpulmonata; Eupulmonata; Stylommatophora; Helicina; Helicoidea; Helicidae; Cornu; Cornu	91502549		DNA	linear	The assembly xgCorAspe16.1 is based on 43x PacBio data and Arima2 Hi-C data generated by the Darwin Tree of Life Project~(https://www.darwintreeoflife.org/). The assembly process included the following sequence of steps: initial PacBio assembly generation with Hifiasm, and Hi-C based scaffolding with YaHS. The mitochondrial genome was assembled using MitoHiFi. Finally, the primary assembly was analysed and manually improved using TreeVal. Chromosome-scale scaffolds confirmed by the Hi-C data have been named in order of size.	2024
