Accession	Length	E-value	Definition	Organism	Taxonomy_x	Release Year_x	query_start	query_end	subject_start	subject_end	Align_Length	Query_Length	Identity(%)	Coverage(%)	Pass_Filter	Source_File	Accession_clean	Description	Taxonomy_y	Accession Length	Sequencing Technology	Molecule Type	Topology	Assembly	Release Year_y
CP131577	1522156	0.020		Photobacterium leiognathi subsp. mandapamensis	Bacteria; Pseudomonadati; Pseudomonadota; Gammaproteobacteria; Vibrionales; Vibrionaceae; Photobacterium	2023	1	24	63	40	24	24	100.00	100.00	YES	Barcode_80_forward_end_BC80_rev_From_Porechop__GAATCGCTATCCTATGTTCATCCG_description_table	CP131577	Photobacterium leiognathi subsp. mandapamensis strain SV1.1 chromosome 2	Bacteria; Pseudomonadati; Pseudomonadota; Gammaproteobacteria; Vibrionales; Vibrionaceae; Photobacterium	1522156	Oxford Nanopore	DNA	circular	##Genome-Assembly-Data-START## ; Assembly Method :: Flye v. 2.9 ; Genome Representation :: Full ; Expected Final Version :: Yes ; Genome Coverage :: 11x ; Sequencing Technology :: Oxford Nanopore MinION ; ##Genome-Assembly-Data-END##	2023
OZ187278	10952758	4.8		Jodis putata	Eukaryota; Metazoa; Ecdysozoa; Arthropoda; Hexapoda; Insecta; Pterygota; Neoptera; Endopterygota; Lepidoptera; Glossata; Ditrysia; Geometroidea; Geometridae; Geometrinae; Jodis	2024	1	20	4629075	4629094	20	24	100.00	83.00	YES	Barcode_80_forward_end_BC80_rev_From_Porechop__GAATCGCTATCCTATGTTCATCCG_description_table	OZ187278	Jodis putata genome assembly, chromosome: 24	Eukaryota; Metazoa; Ecdysozoa; Arthropoda; Hexapoda; Insecta; Pterygota; Neoptera; Endopterygota; Lepidoptera; Glossata; Ditrysia; Geometroidea; Geometridae; Geometrinae; Jodis	10952758		DNA	linear	The assembly ilJodPuta1.hap1.1 is based on 34x PacBio data and Arima2 Hi-C data generated by Project Psyche (https://www.projectpsyche.org/). The assembly process included the following sequence of steps: initial PacBio assembly generation with Hifiasm in Hi-C integrated assembly mode, and Hi-C based scaffolding with YaHS. The mitochondrial genome was assembled using MitoHiFi. Finally, each haplotype assembly was analysed and manually improved using TreeVal. Chromosome-scale scaffolds confirmed by the Hi-C data have been named in order of size. Chromosome Z was assigned by synteny to GCA_907269075.1.	2024
OZ229102	74602749	4.8		Podarcis tiliguerta	Eukaryota; Metazoa; Chordata; Craniata; Vertebrata; Euteleostomi; Lepidosauria; Squamata; Bifurcata; Unidentata; Episquamata; Laterata; Lacertibaenia; Lacertidae; Podarcis	2025	1	20	68827495	68827476	20	24	100.00	83.00	YES	Barcode_80_forward_end_BC80_rev_From_Porechop__GAATCGCTATCCTATGTTCATCCG_description_table	OZ229102	Podarcis tiliguerta genome assembly, chromosome: 10	Eukaryota; Metazoa; Chordata; Craniata; Vertebrata; Euteleostomi; Lepidosauria; Squamata; Bifurcata; Unidentata; Episquamata; Laterata; Lacertibaenia; Lacertidae; Podarcis	74602749	Oxford Nanopore	DNA	linear	The assembly rPodTil1.hap2.2 is based on 15x PacBio data and Arima2 Hi-C data generated by the Wellcome Sanger Institute Tree of Life Programme (https://www.sanger.ac.uk/programme/tree-of-life/). The assembly process included the following sequence of steps: initial PacBio assembly generation with Hifiasm in Hi-C integrated assembly mode, and Hi-C based scaffolding with YaHS. The mitochondrial genome was assembled using MitoHiFi. Finally, each haplotype assembly was analysed and manually improved using TreeVal. Chromosome-scale scaffolds confirmed by the Hi-C data have been named in order of size. The Z and W chromosomes were identified based on its single-copy status within a diploid assembly and synteny analysis with Podarcis siculus (GCA_964188175.1)The exact order and orientation of the contigs on chromosome 6 (85,700 - 89,500 Kbp) are unknown. The exact order and orientation of the contigs on chromosome 7 (75,200 - 81,200 Kbp) are unknown. The exact order and orientation of the contigs on chromosome 12 (8,200 - 11,700 Kbp) are unknown. The exact order and orientation of the contigs on chromosome 14 (9,500 - 12,400 Kbp) are unknown. Chromosome 18 is notably small, measuring only 12,718 Kbp in the assembled genome.	2025
OZ195117	20210446	4.8		Cupido argiades	Eukaryota; Metazoa; Ecdysozoa; Arthropoda; Hexapoda; Insecta; Pterygota; Neoptera; Endopterygota; Lepidoptera; Glossata; Ditrysia; Papilionoidea; Lycaenidae; Polyommatinae; Cupido	2024	3	22	16092956	16092937	20	24	100.00	83.00	YES	Barcode_80_forward_end_BC80_rev_From_Porechop__GAATCGCTATCCTATGTTCATCCG_description_table	OZ195117	Cupido argiades genome assembly, chromosome: 5	Eukaryota; Metazoa; Ecdysozoa; Arthropoda; Hexapoda; Insecta; Pterygota; Neoptera; Endopterygota; Lepidoptera; Glossata; Ditrysia; Papilionoidea; Lycaenidae; Polyommatinae; Cupido	20210446		DNA	linear	The assembly ilCupArgi2.hap1.1 is based on 35x PacBio data and Arima2 Hi-C data generated by Project Psyche (https://www.projectpsyche.org/). The assembly process included the following sequence of steps: initial PacBio assembly generation with Hifiasm in Hi-C integrated assembly mode, and Hi-C based scaffolding with YaHS. The mitochondrial genome was assembled using MitoHiFi. Finally, each haplotype assembly was analysed and manually improved using TreeVal. Chromosome-scale scaffolds confirmed by the Hi-C data have been named in order of size. Chromosomes W, Z1 and Z2 were assigned by HiC signal.	2024
LR990212	10008955	4.8		Hylaea fasciaria	Eukaryota; Metazoa; Ecdysozoa; Arthropoda; Hexapoda; Insecta; Pterygota; Neoptera; Endopterygota; Lepidoptera; Glossata; Ditrysia; Geometroidea; Geometridae; Ennominae; Hylaea	2021	1	20	6259056	6259037	20	24	100.00	83.00	YES	Barcode_80_forward_end_BC80_rev_From_Porechop__GAATCGCTATCCTATGTTCATCCG_description_table	LR990212	Hylaea fasciaria genome assembly, chromosome: 20	Eukaryota; Metazoa; Ecdysozoa; Arthropoda; Hexapoda; Insecta; Pterygota; Neoptera; Endopterygota; Lepidoptera; Glossata; Ditrysia; Geometroidea; Geometridae; Ennominae; Hylaea	10008955		DNA	linear	The assembly ilHylFasc1.1 is based on 72x PacBio data, 10X Genomics Chromium data, and Arima Hi-C data generated by the Darwin Tree of Life Project (https://www.darwintreeoflife.org/). The assembly process included the following sequence of steps: initial PacBio assembly generation with Hifiasm, retained haplotig separation with purge_dups, short-read polishing using FreeBayes-called variants from 10X Genomics Chromium reads aligned with LongRanger, and Hi-C based scaffolding with SALSA2. The mitochondrial genome was assembled using MitoHifi. Finally, the assembly was analysed and manually improved using gEVAL. Chromosome-scale scaffolds confirmed by the Hi-C data have been named in order of size.	2021
