Accession	Length	E-value	Definition	Organism	Taxonomy_x	Release Year_x	query_start	query_end	subject_start	subject_end	Align_Length	Query_Length	Identity(%)	Coverage(%)	Pass_Filter	Source_File	Accession_clean	Description	Taxonomy_y	Accession Length	Sequencing Technology	Molecule Type	Topology	Assembly	Release Year_y
OY729845	6261773	6.0		Corticium candelabrum	Eukaryota; Metazoa; Porifera; Homoscleromorpha; Homosclerophorida; Plakinidae; Corticium	2023	4	23	5048276	5048295	20	24	100.00	83.00	YES	Barcode_16_forward_end_BC16_rev_From_Porechop_gc_random_7__TGCTTCGTGTTGCACGGCGCCGTG_description_table	OY729845	Corticium candelabrum genome assembly, chromosome: 19	Eukaryota; Metazoa; Porifera; Homoscleromorpha; Homosclerophorida; Plakinidae; Corticium	6261773		DNA	linear	The assembly ooCorCand1.1 is based on 70x PacBio data and Arima2 Hi-C data generated by the Aquatic Symbiosis Genomics Project (https://www.aquaticsymbiosisgenomics.org/). The assembly process included the following sequence of steps: initial PacBio assembly generation with Hifiasm, retained haplotig separation with purge_dups, and Hi-C based scaffolding with YaHS. The mitochondrial genome was assembled using MitoHiFi. Finally, the primary assembly was analysed and manually improved using gEVAL. Chromosome-scale scaffolds confirmed by the Hi-C data have been named in order of size.	2023
OY729167	25958298	6.0		Drosophila histrio	Eukaryota; Metazoa; Ecdysozoa; Arthropoda; Hexapoda; Insecta; Pterygota; Neoptera; Endopterygota; Diptera; Brachycera; Muscomorpha; Ephydroidea; Drosophilidae; Drosophila	2023	2	21	12976006	12976025	20	24	100.00	83.00	YES	Barcode_16_forward_end_BC16_rev_From_Porechop_gc_random_7__TGCTTCGTGTTGCACGGCGCCGTG_description_table	OY729167	Drosophila histrio genome assembly, chromosome: 4	Eukaryota; Metazoa; Ecdysozoa; Arthropoda; Hexapoda; Insecta; Pterygota; Neoptera; Endopterygota; Diptera; Brachycera; Muscomorpha; Ephydroidea; Drosophilidae; Drosophila	25958298		DNA	linear	The assembly idDroHist2.2 is based on 45x PacBio data and Arima2 Hi-C data generated by the Darwin Tree of Life Project~(https://www.darwintreeoflife.org/). The assembly process included the following sequence of steps: initial PacBio assembly generation with Hifiasm, retained haplotig separation with purge_dups, and Hi-C based scaffolding with YaHS. The mitochondrial genome was assembled using MitoHiFi. Finally, the primary assembly was analysed and manually improved using rapid curation. Chromosome-scale scaffolds confirmed by the Hi-C data have been named in order of size. The X chromosome was identified by synteny with idDroPhal2.1 (GCA_951394115.1) and has a dot chromosome fusion. The 0-15Mb region of Chromosome X is of unknown order and orientation.	2023
BK018131	54055	6.0		Caudoviricetes sp.	Viruses; Duplodnaviria; Heunggongvirae; Uroviricota; Caudoviricetes	2021	5	24	20632	20651	20	24	100.00	83.00	YES	Barcode_16_forward_end_BC16_rev_From_Porechop_gc_random_7__TGCTTCGTGTTGCACGGCGCCGTG_description_table	BK018131	MAG TPA_asm: Caudoviricetes sp. isolate cthFy9, partial genome	Viruses; Duplodnaviria; Heunggongvirae; Uroviricota; Caudoviricetes	54055		DNA	linear	##Assembly-Data-START## ; Assembly Method :: MEGAHIT v. 1.2.9 ; Genome Coverage :: 36.7219x ; Sequencing Technology :: Illumina ; Annotation Pipeline :: Cenote-Taker2 ; URL :: https://github.com/mtisza1/Cenote-Taker2 ; ##Assembly-Data-END##	2021
OZ414524	45425987	6.0		Favorinus blianus	Eukaryota; Metazoa; Spiralia; Lophotrochozoa; Mollusca; Gastropoda; Heterobranchia; Euthyneura; Nudipleura; Nudibranchia; Cladobranchia; Aeolidioidea; Facelinidae; Favorinus	2026	5	24	33938509	33938528	20	24	100.00	83.00	YES	Barcode_16_forward_end_BC16_rev_From_Porechop_gc_random_7__TGCTTCGTGTTGCACGGCGCCGTG_description_table	OZ414524	Favorinus blianus genome assembly, chromosome: 7	Eukaryota; Metazoa; Spiralia; Lophotrochozoa; Mollusca; Gastropoda; Heterobranchia; Euthyneura; Nudipleura; Nudibranchia; Cladobranchia; Aeolidioidea; Facelinidae; Favorinus	45425987		DNA	linear	The assembly xgFavBlia1.hap1.1 is based on 52x PacBio data and Arima2 Hi-C data generated by the Darwin Tree of Life Project~(https://www.darwintreeoflife.org/). The assembly process included the following sequence of steps: initial PacBio assembly generation with Hifiasm in Hi-C integrated assembly mode, and Hi-C based scaffolding with YaHS. The mitochondrial genome was assembled using MitoHiFi. Finally, each haplotype assembly was analysed and manually improved using TreeVal. Chromosome-scale scaffolds confirmed by the Hi-C data have been named in order of size. The genome looks to be very heterozygous, presenting some haplotipic inversions on: Chromosome 3 from 78.61 to 80.83, Chromosome 4 from 48.39 to 67.35, Chromosome 5 from 15.81 to 17.01, Chromosome 8 from 782 kbp to 10.12, from start to 21.25, from 15.23 to 21.25 and from 21.25 to 38.53 Mbp and Chromosome 10 from 1.17 to 6.25 Mbp. The order and orientation of the scaffolds on the following regions are uncertain: Chromosome 1 from 62.19 to 69.44 and Chromosome 14 from 11.42 to 12.07 Mbp.	2026
OZ287142	91878701	6.0		Herbertus stramineus	Eukaryota; Viridiplantae; Streptophyta; Embryophyta; Marchantiophyta; Jungermanniopsida; Jungermanniidae; Jungermanniales; Lophocoleineae; Herbertaceae; Herbertus	2025	3	22	21325726	21325707	20	24	100.00	83.00	YES	Barcode_16_forward_end_BC16_rev_From_Porechop_gc_random_7__TGCTTCGTGTTGCACGGCGCCGTG_description_table	OZ287142	Herbertus stramineus genome assembly, chromosome: 8	Eukaryota; Viridiplantae; Streptophyta; Embryophyta; Marchantiophyta; Jungermanniopsida; Jungermanniidae; Jungermanniales; Lophocoleineae; Herbertaceae; Herbertus	91878701		DNA	linear	The assembly cjHerStra2.1 is based on 48x PacBio data and Arima2 Hi-C data generated by the Darwin Tree of Life Project~(https://www.darwintreeoflife.org/). The assembly process included the following sequence of steps: initial PacBio assembly generation with Hifiasm, and Hi-C based scaffolding with YaHS. The mitochondrial and chloroplast genomes were assembled using OATK. Finally, the primary assembly was analysed and manually improved using TreeVal. Chromosome-scale scaffolds confirmed by the Hi-C data have been named in order of size.	2025
OZ241896	3949503	6.0		Vicinamibacterales bacterium	Bacteria; Pseudomonadati; Acidobacteriota; Vicinamibacteria; Vicinamibacterales	2025	3	22	2426966	2426947	20	24	100.00	83.00	YES	Barcode_16_forward_end_BC16_rev_From_Porechop_gc_random_7__TGCTTCGTGTTGCACGGCGCCGTG_description_table	OZ241896	MAG: Vicinamibacterales bacterium isolate 33c84dbd-3a66-4f2e-aaf6-8813f582eb9b genome assembly, chromosome: 1	Bacteria; Pseudomonadati; Acidobacteriota; Vicinamibacteria; Vicinamibacterales	3949503	Oxford Nanopore	DNA	circular	The metagenome-assembled genome assembly odAgeTubu1.Vicinamibacterales_1.1 is based on 151x PacBio data generated by the Aquatic Symbiosis Genomics Project (https://www.aquaticsymbiosisgenomics.org/). The assembly process included the following sequence of steps: initial PacBio assembly generation with metaMDBG and coverage-, graph-, and HiC-based contig binning.	2025
OZ218201	98704021	6.0		Herbertus hutchinsiae	Eukaryota; Viridiplantae; Streptophyta; Embryophyta; Marchantiophyta; Jungermanniopsida; Jungermanniidae; Jungermanniales; Lophocoleineae; Herbertaceae; Herbertus	2025	3	22	85951110	85951091	20	24	100.00	83.00	YES	Barcode_16_forward_end_BC16_rev_From_Porechop_gc_random_7__TGCTTCGTGTTGCACGGCGCCGTG_description_table	OZ218201	Herbertus hutchinsiae genome assembly, chromosome: 8	Eukaryota; Viridiplantae; Streptophyta; Embryophyta; Marchantiophyta; Jungermanniopsida; Jungermanniidae; Jungermanniales; Lophocoleineae; Herbertaceae; Herbertus	98704021		DNA	linear	The assembly cjHerHutc3.1 is based on 105x PacBio data and Arima2 Hi-C data generated by the Darwin Tree of Life Project~(https://www.darwintreeoflife.org/). The assembly process included the following sequence of steps: initial PacBio assembly generation with Hifiasm, and Hi-C based scaffolding with YaHS. The mitochondrial and chloroplast genomes were assembled using OATK. Finally, the primary assembly was analysed and manually improved using TreeVal. Chromosome-scale scaffolds confirmed by the Hi-C data have been named in order of size.	2025
XM_062663694	1068	6.0		Corticium candelabrum	Eukaryota; Metazoa; Porifera; Homoscleromorpha; Homosclerophorida; Plakinidae; Corticium	2024	4	23	324	305	20	24	100.00	83.00	YES	Barcode_16_forward_end_BC16_rev_From_Porechop_gc_random_7__TGCTTCGTGTTGCACGGCGCCGTG_description_table	XM_062663694	PREDICTED: Corticium candelabrum protein HEXIM1-like (LOC134194742), mRNA	Eukaryota; Metazoa; Porifera; Homoscleromorpha; Homosclerophorida; Plakinidae; Corticium	1068		mRNA	linear		2024
