Accession	Length	E-value	Definition	Organism	Taxonomy_x	Release Year_x	query_start	query_end	subject_start	subject_end	Align_Length	Query_Length	Identity(%)	Coverage(%)	Pass_Filter	Source_File	Accession_clean	Description	Taxonomy_y	Accession Length	Sequencing Technology	Molecule Type	Topology	Assembly	Release Year_y
OZ413741	18749387	1.5		Crossocerus annulipes	Eukaryota; Metazoa; Ecdysozoa; Arthropoda; Hexapoda; Insecta; Pterygota; Neoptera; Endopterygota; Hymenoptera; Apocrita; Aculeata; Apoidea; Crabronidae; Crabroninae; Crabronini; Crabronina; Crossocerus	2026	3	23	8205535	8205555	21	24	100.00	88.00	YES	Barcode_17_forward_end_BC17_rev_From_Porechop_gc_random_3__TAATTCCTGGGATGCTTGGCGCAC_description_table	OZ413741	Crossocerus annulipes genome assembly, chromosome: 4	Eukaryota; Metazoa; Ecdysozoa; Arthropoda; Hexapoda; Insecta; Pterygota; Neoptera; Endopterygota; Hymenoptera; Apocrita; Aculeata; Apoidea; Crabronidae; Crabroninae; Crabronini; Crabronina; Crossocerus	18749387		DNA	linear	The assembly iyCroAnnu1.hap1.1 is based on 88x PacBio data and Arima2 Hi-C data generated by the Darwin Tree of Life Project~(https://www.darwintreeoflife.org/). The assembly process included the following sequence of steps: initial PacBio assembly generation with Hifiasm in Hi-C integrated assembly mode, and Hi-C based scaffolding with YaHS. The mitochondrial genome was assembled using OATK. Finally, each haplotype assembly was analysed and manually improved using TreeVal. Chromosome-scale scaffolds confirmed by the Hi-C data have been named in order of size. The scaffolds order and orientation on Chromosome 12 from the start to 1.88 Mbp and Chromosome 8 from the start to 1.11 Mbp are uncertain.	2026
XM_073656440	3869	6.0		Phyllobates terribilis	Eukaryota; Metazoa; Chordata; Craniata; Vertebrata; Euteleostomi; Amphibia; Batrachia; Anura; Neobatrachia; Hyloidea; Dendrobatidae; Dendrobatinae; Phyllobates	2025	3	22	349	368	20	24	100.00	83.00	YES	Barcode_17_forward_end_BC17_rev_From_Porechop_gc_random_3__TAATTCCTGGGATGCTTGGCGCAC_description_table	XM_073656440	PREDICTED: Phyllobates terribilis DNA polymerase delta 1, catalytic subunit (POLD1), transcript variant X2, mRNA	Eukaryota; Metazoa; Chordata; Craniata; Vertebrata; Euteleostomi; Amphibia; Batrachia; Anura; Neobatrachia; Hyloidea; Dendrobatidae; Dendrobatinae; Phyllobates	3869		mRNA	linear		2025
XM_073656439	3984	6.0		Phyllobates terribilis	Eukaryota; Metazoa; Chordata; Craniata; Vertebrata; Euteleostomi; Amphibia; Batrachia; Anura; Neobatrachia; Hyloidea; Dendrobatidae; Dendrobatinae; Phyllobates	2025	3	22	464	483	20	24	100.00	83.00	YES	Barcode_17_forward_end_BC17_rev_From_Porechop_gc_random_3__TAATTCCTGGGATGCTTGGCGCAC_description_table	XM_073656439	PREDICTED: Phyllobates terribilis DNA polymerase delta 1, catalytic subunit (POLD1), transcript variant X1, mRNA	Eukaryota; Metazoa; Chordata; Craniata; Vertebrata; Euteleostomi; Amphibia; Batrachia; Anura; Neobatrachia; Hyloidea; Dendrobatidae; Dendrobatinae; Phyllobates	3984		mRNA	linear		2025
OZ224124	28490643	6.0		Lineus lacteus	Eukaryota; Metazoa; Spiralia; Lophotrochozoa; Nemertea; Pilidiophora; Heteronemertea; Lineidae; Lineus	2025	2	21	21383724	21383743	20	24	100.00	83.00	YES	Barcode_17_forward_end_BC17_rev_From_Porechop_gc_random_3__TAATTCCTGGGATGCTTGGCGCAC_description_table	OZ224124	Lineus lacteus genome assembly, chromosome: 4	Eukaryota; Metazoa; Spiralia; Lophotrochozoa; Nemertea; Pilidiophora; Heteronemertea; Lineidae; Lineus	28490643		DNA	linear		2025
XM_044532128	1298	6.0		Triticum aestivum	Eukaryota; Viridiplantae; Streptophyta; Embryophyta; Tracheophyta; Spermatophyta; Magnoliopsida; Liliopsida; Poales; Poaceae; BOP clade; Pooideae; Triticodae; Triticeae; Triticinae; Triticum	2025	1	20	577	558	20	24	100.00	83.00	YES	Barcode_17_forward_end_BC17_rev_From_Porechop_gc_random_3__TAATTCCTGGGATGCTTGGCGCAC_description_table	XM_044532128	PREDICTED: Triticum aestivum WRKY transcription factor 22 (LOC123111350), mRNA	Eukaryota; Viridiplantae; Streptophyta; Embryophyta; Tracheophyta; Spermatophyta; Magnoliopsida; Liliopsida; Poales; Poaceae; BOP clade; Pooideae; Triticodae; Triticeae; Triticinae; Triticum	1298		mRNA	linear		2025
XM_037584593	1273	6.0		Triticum dicoccoides	Eukaryota; Viridiplantae; Streptophyta; Embryophyta; Tracheophyta; Spermatophyta; Magnoliopsida; Liliopsida; Poales; Poaceae; BOP clade; Pooideae; Triticodae; Triticeae; Triticinae; Triticum	2020	1	20	579	560	20	24	100.00	83.00	YES	Barcode_17_forward_end_BC17_rev_From_Porechop_gc_random_3__TAATTCCTGGGATGCTTGGCGCAC_description_table	XM_037584593	PREDICTED: Triticum dicoccoides WRKY transcription factor 22-like (LOC119308460), mRNA	Eukaryota; Viridiplantae; Streptophyta; Embryophyta; Tracheophyta; Spermatophyta; Magnoliopsida; Liliopsida; Poales; Poaceae; BOP clade; Pooideae; Triticodae; Triticeae; Triticinae; Triticum	1273		mRNA	linear		2020
OZ412171	25293736	6.0		Freudenthalidium endolithicum	Eukaryota; Sar; Alveolata; Dinophyceae; Suessiales; Symbiodiniaceae; Freudenthalidium	2026	2	21	147987	148006	20	24	100.00	83.00	YES	Barcode_17_forward_end_BC17_rev_From_Porechop_gc_random_3__TAATTCCTGGGATGCTTGGCGCAC_description_table	OZ412171	Freudenthalidium endolithicum genome assembly, chromosome: 10	Eukaryota; Sar; Alveolata; Dinophyceae; Suessiales; Symbiodiniaceae; Freudenthalidium	25293736	Oxford Nanopore	DNA	linear	The assembly pyFreEndo4.1 is based on 19x PacBio data and Arima2 Hi-C data generated by the Aquatic Symbiosis Genomics Project (https://www.aquaticsymbiosisgenomics.org/). The assembly process included the following sequence of steps: initial PacBio assembly generation with Hifiasm, and Hi-C based scaffolding with YaHS. Finally, the primary assembly was analysed and manually improved using TreeVal. Chromosome-scale scaffolds confirmed by the Hi-C data have been named in order of size. Due to the quality of the data the exact order and orientation of the contigs making up the chromosomes is unsure.	2026
OZ407465	45845825	6.0		Scorpaena notata	Eukaryota; Metazoa; Chordata; Craniata; Vertebrata; Euteleostomi; Actinopterygii; Neopterygii; Teleostei; Neoteleostei; Acanthomorphata; Eupercaria; Perciformes; Scorpaenoidei; Scorpaenidae; Scorpaeninae; Scorpaena	2026	2	21	20907554	20907535	20	24	100.00	83.00	YES	Barcode_17_forward_end_BC17_rev_From_Porechop_gc_random_3__TAATTCCTGGGATGCTTGGCGCAC_description_table	OZ407465	Scorpaena notata genome assembly, chromosome: 14	Eukaryota; Metazoa; Chordata; Craniata; Vertebrata; Euteleostomi; Actinopterygii; Neopterygii; Teleostei; Neoteleostei; Acanthomorphata; Eupercaria; Perciformes; Scorpaenoidei; Scorpaenidae; Scorpaeninae; Scorpaena	45845825	Oxford Nanopore	DNA	linear	Genome assembly of Scorpaena notata. This assembly is provided by the ATLASea programme (https://www.atlasea.fr). The assembly of Scorpaena notata (fScoNot1) is based on 82X PacBio data and 220X Arima Hi-C data generated as part of the ATLASea programme (https://www.atlasea.fr). The assembly process included the following steps: initial PacBio assembly generation with Hifiasm, removal of contaminant sequences using Context, removal of haplotypic duplications using purge_dups, and Hi-C-based scaffolding with YaHS. In total, 2 contigs were identified as contaminants (bacterial, archaeal, or viral), totaling 0.102 Mb (with the largest being 0.076 Mb). Additionally, 160 regions totaling 9.826 Mb (with the largest being 2.099 Mb) were identified as haplotypic duplications and removed. Mitochondrial genome was assembled using OATK. During manual curation, 1 haplotypic region was removed, totaling 5.5Mb. Chromosome-scale scaffolds confirmed by Hi-C data were named in order of size.	2026
