Accession	Length	E-value	Definition	Organism	Taxonomy_x	Release Year_x	query_start	query_end	subject_start	subject_end	Align_Length	Query_Length	Identity(%)	Coverage(%)	Pass_Filter	Source_File	Accession_clean	Description	Taxonomy_y	Accession Length	Sequencing Technology	Molecule Type	Topology	Assembly	Release Year_y
OZ389950	71955707	0.38		Rochia nilotica	Eukaryota; Metazoa; Spiralia; Lophotrochozoa; Mollusca; Gastropoda; Vetigastropoda; Trochida; Trochoidea; Tegulidae; Rochia	2026	1	22	37484454	37484475	22	22	100.00	100.00	YES	PCR_adapters_1_start_PCR_1_start_From_Porechop_gc_random_7__TGCACTGGGTGAAGTGAGACTG_description_table	OZ389950	Rochia nilotica genome assembly, chromosome: 10	Eukaryota; Metazoa; Spiralia; Lophotrochozoa; Mollusca; Gastropoda; Vetigastropoda; Trochida; Trochoidea; Tegulidae; Rochia	71955707	Oxford Nanopore	DNA	linear	The assembly of Rochia nilotica (xgRocNilo1) is based on 41X PacBio data and 201X Arima Hi-C data generated as part of the ATLASea programme (https://www.atlasea.fr). The assembly process included the following steps: initial PacBio assembly generation with Hifiasm, removal of contaminant sequences using Context, removal of haplotypic duplications using purge_dups, and Hi-C-based scaffolding with YaHS. No contigs were found to be contaminants (bacterial, archaeal, or viral). Additionally, 179 regions totaling 26.247 Mb (with the largest being 2.144 Mb) were identified as haplotypic duplications and removed. Mitochondrial genome was assembled using OATK. During manual curation, 6 haplotypic regions were removed, totaling 3,384,646 pb (with the largest being 874,703 pb). Chromosome-scale scaffolds confirmed by Hi-C data were named in order of size.	2026
OZ387118	59191062	0.38		Lepas anatifera	Eukaryota; Metazoa; Ecdysozoa; Arthropoda; Crustacea; Multicrustacea; Cirripedia; Thoracica; Thoracicalcarea; Scalpellomorpha; Lepadoidea; Lepadidae; Lepas	2025	1	22	40252843	40252864	22	22	100.00	100.00	YES	PCR_adapters_1_start_PCR_1_start_From_Porechop_gc_random_7__TGCACTGGGTGAAGTGAGACTG_description_table	OZ387118	Lepas anatifera genome assembly, chromosome: 4	Eukaryota; Metazoa; Ecdysozoa; Arthropoda; Crustacea; Multicrustacea; Cirripedia; Thoracica; Thoracicalcarea; Scalpellomorpha; Lepadoidea; Lepadidae; Lepas	59191062		DNA	linear	The assembly qxLepAnat2.1 is based on 100x PacBio data and Arima2 Hi-C data generated by the Darwin Tree of Life Project~(https://www.darwintreeoflife.org/). The assembly process included the following sequence of steps: initial PacBio assembly generation with Hifiasm, and Hi-C based scaffolding with YaHS. The mitochondrial genome was assembled using MitoHiFi. A manually phased assembly (based on HiC signal) was generated from a jointly curated primary and alt assembly. Finally, the primary assembly was analysed and manually improved using TreeVal. Chromosome-scale scaffolds confirmed by the Hi-C data have been named in order of size.	2025
OZ330409	22248618	5.9		Nautilus macromphalus	Eukaryota; Metazoa; Spiralia; Lophotrochozoa; Mollusca; Cephalopoda; Nautiloidea; Nautilida; Nautilidae; Nautilus	2025	3	22	18106403	18106422	20	22	100.00	91.00	YES	PCR_adapters_1_start_PCR_1_start_From_Porechop_gc_random_7__TGCACTGGGTGAAGTGAGACTG_description_table	OZ330409	Nautilus macromphalus genome assembly, chromosome: 17	Eukaryota; Metazoa; Spiralia; Lophotrochozoa; Mollusca; Cephalopoda; Nautiloidea; Nautilida; Nautilidae; Nautilus	22248618	Oxford Nanopore	DNA	linear	The assembly of Nautilus macromphalus (xcNauMacr1) is based on 117X ONT data and 201X Arima Hi-C data generated as part of the ATLASea programme (https://www.atlasea.fr). The assembly process included the following steps: initial ONT assembly generation with Hifiasm, removal of contaminant sequences using Context, removal of haplotypic duplications using purge_dups, and Hi-C-based scaffolding with YaHS. In total, 22 contigs were identified as contaminants (bacterial, archaeal, or viral), totaling 5.948 Mb (with the largest being 4.224 Mb). Additionally, 2000 regions totaling 75.218 Mb (with the largest being 1.853 Mb) were identified as haplotypic duplications and removed. The mitochondrial genome was assembled using OATK. Finally, the primary assembly was analyzed and manually improved using Pretext. During manual curation, 7 haplotypic regions and 20 contaminant sequences were removed, totaling 3.769 Mb and 3.780 Mb, respectively (with the largest being 2.401 Mb and 1.200 Mb). Chromosome-scale scaffolds confirmed by Hi-C data were named in order of size. The sexual chromosomes were tagged as X and Y based on the fact that they are half the coverage of other chromosomes and harbor telomeric repeats on both ends.	2025
CP027283	21943731	5.9		Lateolabrax maculatus	Eukaryota; Metazoa; Chordata; Craniata; Vertebrata; Euteleostomi; Actinopterygii; Neopterygii; Teleostei; Neoteleostei; Acanthomorphata; Eupercaria; Acropomatiformes; Lateolabracidae; Lateolabrax	2019	1	20	21398269	21398288	20	22	100.00	91.00	YES	PCR_adapters_1_start_PCR_1_start_From_Porechop_gc_random_7__TGCACTGGGTGAAGTGAGACTG_description_table	CP027283	Lateolabrax maculatus chromosome Lm22	Eukaryota; Metazoa; Chordata; Craniata; Vertebrata; Euteleostomi; Actinopterygii; Neopterygii; Teleostei; Neoteleostei; Acanthomorphata; Eupercaria; Acropomatiformes; Lateolabracidae; Lateolabrax	21943731		DNA	linear	##Genome-Assembly-Data-START## ; Assembly Method :: SOAPdenovo v. 2.04 ; Genome Representation :: Full ; Expected Final Version :: Yes ; Genome Coverage :: 302.0x ; Sequencing Technology :: Illumina HiSeq; BGI-Seq 500 ; ##Genome-Assembly-Data-END##	2019
CP154995	71665632	5.9		Euglena gracilis	Eukaryota; Discoba; Euglenozoa; Euglenida; Spirocuta; Euglenophyceae; Euglenales; Euglenaceae; Euglena	2024	2	21	2473419	2473438	20	22	100.00	91.00	YES	PCR_adapters_1_start_PCR_1_start_From_Porechop_gc_random_7__TGCACTGGGTGAAGTGAGACTG_description_table	CP154995	Euglena gracilis isolate CCAP 1224/5Z chromosome 42	Eukaryota; Discoba; Euglenozoa; Euglenida; Spirocuta; Euglenophyceae; Euglenales; Euglenaceae; Euglena	71665632		DNA	linear	##Genome-Assembly-Data-START## ; Assembly Method :: NextDenovo v. v2.2-beta.0; NextPolish v. v1.0.1; Sovle v. v3.3; 3D-DNA pipeline v. v201008; JuiceBox v. v2.20.00 ; Genome Representation :: Full ; Expected Final Version :: No ; Genome Coverage :: 100.0x ; Sequencing Technology :: Illumina NovaSeq; PacBio RSII; Bionano ; ##Genome-Assembly-Data-END##	2024
CP154995	71665632	5.9		Euglena gracilis	Eukaryota; Discoba; Euglenozoa; Euglenida; Spirocuta; Euglenophyceae; Euglenales; Euglenaceae; Euglena	2024	2	21	3678720	3678701	20	22	100.00	91.00	YES	PCR_adapters_1_start_PCR_1_start_From_Porechop_gc_random_7__TGCACTGGGTGAAGTGAGACTG_description_table	CP154995	Euglena gracilis isolate CCAP 1224/5Z chromosome 42	Eukaryota; Discoba; Euglenozoa; Euglenida; Spirocuta; Euglenophyceae; Euglenales; Euglenaceae; Euglena	71665632		DNA	linear	##Genome-Assembly-Data-START## ; Assembly Method :: NextDenovo v. v2.2-beta.0; NextPolish v. v1.0.1; Sovle v. v3.3; 3D-DNA pipeline v. v201008; JuiceBox v. v2.20.00 ; Genome Representation :: Full ; Expected Final Version :: No ; Genome Coverage :: 100.0x ; Sequencing Technology :: Illumina NovaSeq; PacBio RSII; Bionano ; ##Genome-Assembly-Data-END##	2024
